"id_del_producto","nombre_del_producto","categoria","subcategoria"
"OFF-AR-10001860-1","BIC Liqua Brite Liner","Material de oficina","Arte"
"OFF-AR-10001868-1","Prang Dustless Chalk Sticks","Material de oficina","Arte"
"OFF-AR-10001897-1","Model L Table or Wall-Mount Pencil Sharpener","Material de oficina","Arte"
"OFF-AR-10001915-1","Peel-Off China Markers","Material de oficina","Arte"
"OFF-AR-10001919-1","OIC #2 Pencils, Medium Soft","Material de oficina","Arte"
"OFF-AR-10001940-1","Sanford Colorific Eraseable Coloring Pencils, 12 Count","Material de oficina","Arte"
"OFF-AR-10001953-1","Boston 1645 Deluxe Heavier-Duty Electric Pencil Sharpener","Material de oficina","Arte"
"OFF-AR-10001954-1","Newell 331","Material de oficina","Arte"
"OFF-AR-10001955-1","Newell 319","Material de oficina","Arte"
"OFF-AR-10001958-1","Stanley Bostitch Contemporary Electric Pencil Sharpeners","Material de oficina","Arte"
"OFF-AR-10001972-1","Newell 323","Material de oficina","Arte"
"OFF-AR-10001988-1","Bulldog Table or Wall-Mount Pencil Sharpener","Material de oficina","Arte"
"OFF-AR-10002053-1","Premium Writing Pencils, Soft, #2 by Central Association for the Blind","Material de oficina","Arte"
"OFF-AR-10002067-1","Newell 334","Material de oficina","Arte"
"OFF-AR-10002135-1","Boston Heavy-Duty Trimline Electric Pencil Sharpeners","Material de oficina","Arte"
"OFF-AR-10002221-1","12 Colored Short Pencils","Material de oficina","Arte"
"OFF-AR-10002240-1","Panasonic KP-150 Electric Pencil Sharpener","Material de oficina","Arte"
"OFF-AR-10002255-1","Newell 346","Material de oficina","Arte"
"OFF-AR-10002257-1","Eldon Spacemaker Box, Quick-Snap Lid, Clear","Material de oficina","Arte"
"OFF-AR-10002280-1","Staples in misc. colors","Material de oficina","Arte"
"OFF-AR-10002335-1","DIXON Oriole Pencils","Material de oficina","Arte"
"OFF-AR-10002375-1","Newell 351","Material de oficina","Arte"
"OFF-AR-10002399-1","Dixon Prang Watercolor Pencils, 10-Color Set with Brush","Material de oficina","Arte"
"OFF-AR-10002445-1","SANFORD Major Accent Highlighters","Material de oficina","Arte"
"OFF-AR-10002467-1","Dixon Ticonderoga Pencils","Material de oficina","Arte"
"OFF-AR-10002578-1","Newell 335","Material de oficina","Arte"
"OFF-AR-10002656-1","Sanford Liquid Accent Highlighters","Material de oficina","Arte"
"OFF-AR-10002671-1","Hunt BOSTON Model 1606 High-Volume Electric Pencil Sharpener, Beige","Material de oficina","Arte"
"OFF-AR-10002704-1","Boston 1900 Electric Pencil Sharpener","Material de oficina","Arte"
"OFF-AR-10002766-1","Prang Drawing Pencil Set","Material de oficina","Arte"
"OFF-AR-10002804-1","Faber Castell Col-Erase Pencils","Material de oficina","Arte"
"OFF-AR-10002818-1","Panasonic KP-310 Heavy-Duty Electric Pencil Sharpener","Material de oficina","Arte"
"OFF-AR-10002833-1","Newell 322","Material de oficina","Arte"
"OFF-AR-10002952-1","Stanley Contemporary Battery Pencil Sharpeners","Material de oficina","Arte"
"OFF-AR-10002956-1","Boston 16801 Nautilus Battery Pencil Sharpener","Material de oficina","Arte"
"OFF-AR-10002987-1","Prismacolor Color Pencil Set","Material de oficina","Arte"
"OFF-AR-10003045-1","Prang Colored Pencils","Material de oficina","Arte"
"OFF-AR-10003056-1","Newell 341","Material de oficina","Arte"
"OFF-AR-10003087-1","Staples in misc. colors","Material de oficina","Arte"
"OFF-AR-10003156-1","50 Colored Long Pencils","Material de oficina","Arte"
"OFF-AR-10003158-1","Fluorescent Highlighters by Dixon","Material de oficina","Arte"
"OFF-AR-10003179-1","Dixon Ticonderoga Core-Lock Colored Pencils","Material de oficina","Arte"
"OFF-AR-10003183-1","Avery Fluorescent Highlighter Four-Color Set","Material de oficina","Arte"
"OFF-AR-10003190-1","Newell 32","Material de oficina","Arte"
"OFF-AR-10003217-1","Newell 316","Material de oficina","Arte"
"OFF-AR-10003251-1","Prang Drawing Pencil Set","Material de oficina","Arte"
"OFF-AR-10003338-1","Eberhard Faber 3 1/2"" Golf Pencils","Material de oficina","Arte"
"OFF-AR-10003373-1","Boston School Pro Electric Pencil Sharpener, 1670","Material de oficina","Arte"
"OFF-AR-10003394-1","Newell 332","Material de oficina","Arte"
"OFF-AR-10003405-1","Dixon My First Ticonderoga Pencil, #2","Material de oficina","Arte"
"OFF-AR-10003469-1","Nontoxic Chalk","Material de oficina","Arte"
"OFF-AR-10003477-1","4009 Highlighters","Material de oficina","Arte"
"OFF-AR-10003478-1","Avery Hi-Liter EverBold Pen Style Fluorescent Highlighters, 4/Pack","Material de oficina","Arte"
"OFF-AR-10003481-1","Newell 348","Material de oficina","Arte"
"OFF-AR-10003504-1","Newell 347","Material de oficina","Arte"
"OFF-AR-10003514-1","4009 Highlighters by Sanford","Material de oficina","Arte"
"OFF-AR-10003560-1","Zebra Zazzle Fluorescent Highlighters","Material de oficina","Arte"
"OFF-AR-10003582-1","Boston Electric Pencil Sharpener, Model 1818, Charcoal Black","Material de oficina","Arte"
"OFF-AR-10003602-1","Quartet Omega Colored Chalk, 12/Pack","Material de oficina","Arte"
"OFF-AR-10003631-1","Staples in misc. colors","Material de oficina","Arte"
"OFF-AR-10003651-1","Newell 350","Material de oficina","Arte"
"OFF-AR-10003696-1","Panasonic KP-350BK Electric Pencil Sharpener with Auto Stop","Material de oficina","Arte"
"OFF-AR-10003723-1","Avery Hi-Liter Fluorescent Desk Style Markers","Material de oficina","Arte"
"OFF-AR-10003727-1","Berol Giant Pencil Sharpener","Material de oficina","Arte"
"OFF-AR-10003732-1","Newell 333","Material de oficina","Arte"
"OFF-AR-10003752-1","Deluxe Chalkboard Eraser Cleaner","Material de oficina","Arte"
"OFF-AR-10003759-1","Crayola Anti Dust Chalk, 12/Pack","Material de oficina","Arte"
"OFF-AR-10003770-1","Newell 340","Material de oficina","Arte"
"OFF-AR-10003772-1","Boston 16750 Black Compact Battery Pencil Sharpener","Material de oficina","Arte"
"OFF-AR-10003811-1","Newell 327","Material de oficina","Arte"
"OFF-AR-10003829-1","Newell 35","Material de oficina","Arte"
"OFF-AR-10003856-1","Newell 344","Material de oficina","Arte"
"OFF-AR-10003876-1","Avery Hi-Liter GlideStik Fluorescent Highlighter, Yellow Ink","Material de oficina","Arte"
"OFF-AR-10003896-1","Stride Job 150 Highlighters, Chisel Tip, Assorted Colors","Material de oficina","Arte"
"OFF-AR-10003903-1","Sanford 52201 APSCO Electric Pencil Sharpener","Material de oficina","Arte"
"OFF-AR-10003958-1","Newell 337","Material de oficina","Arte"
"OFF-AR-10003986-1","Avery Hi-Liter Pen Style Six-Color Fluorescent Set","Material de oficina","Arte"
"OFF-AR-10004010-1","Hunt Boston Vacuum Mount KS Pencil Sharpener","Material de oficina","Arte"
"OFF-AR-10004022-1","Panasonic KP-380BK Classic Electric Pencil Sharpener","Material de oficina","Arte"
"OFF-AR-10004027-1","Binney & Smith inkTank Erasable Desk Highlighter, Chisel Tip, Yellow, 12/Box","Material de oficina","Arte"
"OFF-AR-10004042-1","BOSTON Model 1800 Electric Pencil Sharpeners, Putty/Woodgrain","Material de oficina","Arte"
"OFF-AR-10004062-1","Staples in misc. colors","Material de oficina","Arte"
"OFF-AR-10004078-1","Newell 312","Material de oficina","Arte"
"OFF-AR-10004165-1","Binney & Smith inkTank Erasable Pocket Highlighter, Chisel Tip, Yellow","Material de oficina","Arte"
"OFF-AR-10004260-1","Boston 1799 Powerhouse Electric Pencil Sharpener","Material de oficina","Arte"
"OFF-AR-10004269-1","Newell 31","Material de oficina","Arte"
"OFF-AR-10004272-1","Newell 308","Material de oficina","Arte"
"OFF-AR-10004344-1","Bulldog Vacuum Base Pencil Sharpener","Material de oficina","Arte"
"OFF-AR-10004441-1","BIC Brite Liner Highlighters","Material de oficina","Arte"
"OFF-AR-10004456-1","Panasonic KP-4ABK Battery-Operated Pencil Sharpener","Material de oficina","Arte"
"OFF-AR-10004511-1","Sanford Colorific Scented Colored Pencils, 12/Pack","Material de oficina","Arte"
"OFF-AR-10004582-1","BIC Brite Liner Grip Highlighters","Material de oficina","Arte"
"OFF-AR-10004587-1","Boston 1827 Commercial Additional Cutter, Drive Gear & Gear Rack for 1606","Material de oficina","Arte"
"OFF-AR-10004602-1","Boston KS Multi-Size Manual Pencil Sharpener","Material de oficina","Arte"
"OFF-AR-10004648-1","Boston 19500 Mighty Mite Electric Pencil Sharpener","Material de oficina","Arte"
"OFF-AR-10004685-1","Binney & Smith Crayola Metallic Colored Pencils, 8-Color Set","Material de oficina","Arte"
"OFF-AR-10004691-1","Boston 1730 StandUp Electric Pencil Sharpener","Material de oficina","Arte"
"OFF-AR-10004707-1","Staples in misc. colors","Material de oficina","Arte"
"OFF-AR-10004752-1","Blackstonian Pencils","Material de oficina","Arte"
"OFF-AR-10004757-1","Crayola Colored Pencils","Material de oficina","Arte"
"OFF-AR-10004790-1","Staples in misc. colors","Material de oficina","Arte"
"OFF-AR-10004817-1","Colorific Watercolor Pencils","Material de oficina","Arte"
"OFF-AR-10004930-1","Turquoise Lead Holder with Pocket Clip","Material de oficina","Arte"
"OFF-AR-10004956-1","Newell 33","Material de oficina","Arte"
"OFF-AR-10004974-1","Newell 342","Material de oficina","Arte"
"OFF-AR-10004999-1","Newell 315","Material de oficina","Arte"
"OFF-BI-10000014-1","Heavy-Duty E-Z-D Binders","Material de oficina","Carpetas"
"OFF-BI-10000042-1","Pressboard Data Binder, Crimson, 12"" X 8 1/2""","Material de oficina","Carpetas"
"OFF-BI-10000050-1","Angle-D Binders with Locking Rings, Label Holders","Material de oficina","Carpetas"
"OFF-BI-10000069-1","GBC Prepunched Paper, 19-Hole, for Binding Systems, 24-lb","Material de oficina","Carpetas"
"OFF-BI-10000088-1","GBC Imprintable Covers","Material de oficina","Carpetas"
"OFF-BI-10000136-1","Avery Non-Stick Heavy Duty View Round Locking Ring Binders","Material de oficina","Carpetas"
"OFF-BI-10000138-1","Acco Translucent Poly Ring Binders","Material de oficina","Carpetas"
"OFF-BI-10000145-1","Zipper Ring Binder Pockets","Material de oficina","Carpetas"
"OFF-BI-10000174-1","Wilson Jones Clip & Carry Folder Binder Tool for Ring Binders, Clear","Material de oficina","Carpetas"
"OFF-BI-10000201-1","Avery Triangle Shaped Sheet Lifters, Black, 2/Pack","Material de oficina","Carpetas"
"OFF-BI-10000216-1","Mead 1st Gear 2"" Zipper Binder, Asst. Colors","Material de oficina","Carpetas"
"OFF-BI-10000279-1","Acco Recycled 2"" Capacity Laser Printer Hanging Data Binders","Material de oficina","Carpetas"
"OFF-BI-10000285-1","XtraLife ClearVue Slant-D Ring Binders by Cardinal","Material de oficina","Carpetas"
"OFF-BI-10000301-1","GBC Instant Report Kit","Material de oficina","Carpetas"
"OFF-BI-10000309-1","GBC Twin Loop Wire Binding Elements, 9/16"" Spine, Black","Material de oficina","Carpetas"
"OFF-BI-10000315-1","Poly Designer Cover & Back","Material de oficina","Carpetas"
"OFF-BI-10000320-1","GBC Plastic Binding Combs","Material de oficina","Carpetas"
"OFF-BI-10000343-1","Pressboard Covers with Storage Hooks, 9 1/2"" x 11"", Light Blue","Material de oficina","Carpetas"
"OFF-BI-10000404-1","Avery Printable Repositionable Plastic Tabs","Material de oficina","Carpetas"
"OFF-BI-10000474-1","Avery Recycled Flexi-View Covers for Binding Systems","Material de oficina","Carpetas"
"OFF-BI-10000494-1","Acco Economy Flexible Poly Round Ring Binder","Material de oficina","Carpetas"
"OFF-BI-10000545-1","GBC Ibimaster 500 Manual ProClick Binding System","Material de oficina","Carpetas"
"OFF-BI-10000546-1","Avery Durable Binders","Material de oficina","Carpetas"
"OFF-BI-10000591-1","Avery Binder Labels","Material de oficina","Carpetas"
"OFF-BI-10000605-1","Acco Pressboard Covers with Storage Hooks, 9 1/2"" x 11"", Executive Red","Material de oficina","Carpetas"
"OFF-BI-10000632-1","Satellite Sectional Post Binders","Material de oficina","Carpetas"
"OFF-BI-10000666-1","Surelock Post Binders","Material de oficina","Carpetas"
"OFF-BI-10000756-1","Storex DuraTech Recycled Plastic Frosted Binders","Material de oficina","Carpetas"
"OFF-BI-10000773-1","Insertable Tab Post Binder Dividers","Material de oficina","Carpetas"
"OFF-BI-10000778-1","GBC VeloBinder Electric Binding Machine","Material de oficina","Carpetas"
"OFF-BI-10000822-1","Acco PRESSTEX Data Binder with Storage Hooks, Light Blue, 9 1/2"" X 11""","Material de oficina","Carpetas"
"OFF-BI-10000829-1","Avery Non-Stick Binders","Material de oficina","Carpetas"
"OFF-BI-10000831-1","Storex Flexible Poly Binders with Double Pockets","Material de oficina","Carpetas"
"OFF-BI-10000848-1","Angle-D Ring Binders","Material de oficina","Carpetas"
"OFF-BI-10000948-1","GBC Laser Imprintable Binding System Covers, Desert Sand","Material de oficina","Carpetas"
"OFF-BI-10000962-1","Acco Flexible ACCOHIDE Square Ring Data Binder, Dark Blue, 11 1/2"" X 14"" 7/8""","Material de oficina","Carpetas"
"OFF-BI-10000977-1","Ibico Plastic Spiral Binding Combs","Material de oficina","Carpetas"
"OFF-BI-10001031-1","Pressboard Data Binders by Wilson Jones","Material de oficina","Carpetas"
"OFF-BI-10001036-1","Cardinal EasyOpen D-Ring Binders","Material de oficina","Carpetas"
"OFF-BI-10001071-1","GBC ProClick Punch Binding System","Material de oficina","Carpetas"
"OFF-BI-10001072-1","GBC Clear Cover, 8-1/2 x 11, unpunched, 25 covers per pack","Material de oficina","Carpetas"
"OFF-BI-10001078-1","Acco PRESSTEX Data Binder with Storage Hooks, Dark Blue, 14 7/8"" X 11""","Material de oficina","Carpetas"
"OFF-BI-10001097-1","Avery Hole Reinforcements","Material de oficina","Carpetas"
"OFF-BI-10001098-1","Acco D-Ring Binder w/DublLock","Material de oficina","Carpetas"
"OFF-BI-10001107-1","GBC White Gloss Covers, Plain Front","Material de oficina","Carpetas"
"OFF-BI-10001116-1","Wilson Jones 1"" Hanging DublLock Ring Binders","Material de oficina","Carpetas"
"OFF-BI-10001120-1","Ibico EPK-21 Electric Binding System","Material de oficina","Carpetas"
"OFF-BI-10001132-1","Acco PRESSTEX Data Binder with Storage Hooks, Dark Blue, 9 1/2"" X 11""","Material de oficina","Carpetas"
"OFF-BI-10001153-1","Ibico Recycled Grain-Textured Covers","Material de oficina","Carpetas"
"OFF-BI-10001191-1","Canvas Sectional Post Binders","Material de oficina","Carpetas"
"OFF-BI-10001196-1","Avery Flip-Chart Easel Binder, Black","Material de oficina","Carpetas"
"OFF-BI-10001249-1","Avery Heavy-Duty EZD View Binder with Locking Rings","Material de oficina","Carpetas"
"OFF-BI-10001267-1","Universal Recycled Hanging Pressboard Report Binders, Letter Size","Material de oficina","Carpetas"
"OFF-BI-10001294-1","Fellowes Binding Cases","Material de oficina","Carpetas"
"OFF-BI-10001308-1","GBC Standard Plastic Binding Systems' Combs","Material de oficina","Carpetas"
"OFF-BI-10001359-1","GBC DocuBind TL300 Electric Binding System","Material de oficina","Carpetas"
"OFF-BI-10001460-1","Plastic Binding Combs","Material de oficina","Carpetas"
"OFF-BI-10001510-1","Deluxe Heavy-Duty Vinyl Round Ring Binder","Material de oficina","Carpetas"
"OFF-BI-10001524-1","GBC Premium Transparent Covers with Diagonal Lined Pattern","Material de oficina","Carpetas"
"OFF-BI-10001525-1","Acco Pressboard Covers with Storage Hooks, 14 7/8"" x 11"", Executive Red","Material de oficina","Carpetas"
"OFF-BI-10001543-1","GBC VeloBinder Manual Binding System","Material de oficina","Carpetas"
"OFF-BI-10001553-1","SpineVue Locking Slant-D Ring Binders by Cardinal","Material de oficina","Carpetas"
"OFF-BI-10001575-1","GBC Linen Binding Covers","Material de oficina","Carpetas"
"OFF-BI-10001597-1","Wilson Jones Ledger-Size, Piano-Hinge Binder, 2"", Blue","Material de oficina","Carpetas"
"OFF-BI-10001617-1","GBC Wire Binding Combs","Material de oficina","Carpetas"
"OFF-BI-10001628-1","Acco Data Flex Cable Posts For Top & Bottom Load Binders, 6"" Capacity","Material de oficina","Carpetas"
"OFF-BI-10001634-1","Wilson Jones Active Use Binders","Material de oficina","Carpetas"
"OFF-BI-10001636-1","Ibico Plastic and Wire Spiral Binding Combs","Material de oficina","Carpetas"
"OFF-BI-10001658-1","GBC Standard Therm-A-Bind Covers","Material de oficina","Carpetas"
"OFF-BI-10001670-1","Vinyl Sectional Post Binders","Material de oficina","Carpetas"
"OFF-BI-10001679-1","GBC Instant Index System for Binding Systems","Material de oficina","Carpetas"
"OFF-BI-10001718-1","GBC DocuBind P50 Personal Binding Machine","Material de oficina","Carpetas"
"OFF-BI-10001721-1","Trimflex Flexible Post Binders","Material de oficina","Carpetas"
"OFF-BI-10001757-1","Pressboard Hanging Data Binders for Unburst Sheets","Material de oficina","Carpetas"
"OFF-BI-10001758-1","Wilson Jones 14 Line Acrylic Coated Pressboard Data Binders","Material de oficina","Carpetas"
"OFF-BI-10001759-1","Acco Pressboard Covers with Storage Hooks, 14 7/8"" x 11"", Dark Blue","Material de oficina","Carpetas"
"OFF-BI-10001765-1","Wilson Jones Heavy-Duty Casebound Ring Binders with Metal Hinges","Material de oficina","Carpetas"
"OFF-BI-10001787-1","Wilson Jones Four-Pocket Poly Binders","Material de oficina","Carpetas"
"OFF-BI-10001890-1","Avery Poly Binder Pockets","Material de oficina","Carpetas"
"OFF-BI-10001900-1","DXL Angle-View Binders with Locking Rings, Black","Material de oficina","Carpetas"
"OFF-BI-10001922-1","Storex Dura Pro Binders","Material de oficina","Carpetas"
"OFF-BI-10001982-1","Wilson Jones Custom Binder Spines & Labels","Material de oficina","Carpetas"
"OFF-BI-10001989-1","Premium Transparent Presentation Covers by GBC","Material de oficina","Carpetas"
"OFF-BI-10002003-1","Ibico Presentation Index for Binding Systems","Material de oficina","Carpetas"
"OFF-BI-10002012-1","Wilson Jones Easy Flow II Sheet Lifters","Material de oficina","Carpetas"
"OFF-BI-10002026-1","Avery Arch Ring Binders","Material de oficina","Carpetas"
"OFF-BI-10002026-2","Ibico Recycled Linen-Style Covers","Material de oficina","Carpetas"
"OFF-BI-10002049-1","UniKeep View Case Binders","Material de oficina","Carpetas"
"OFF-BI-10002071-1","Fellowes Black Plastic Comb Bindings","Material de oficina","Carpetas"
"OFF-BI-10002072-1","Cardinal Slant-D Ring Binders","Material de oficina","Carpetas"
"OFF-BI-10002082-1","GBC Twin Loop Wire Binding Elements","Material de oficina","Carpetas"
"OFF-BI-10002103-1","Cardinal Slant-D Ring Binder, Heavy Gauge Vinyl","Material de oficina","Carpetas"
"OFF-BI-10002133-1","Wilson Jones Elliptical Ring 3 1/2"" Capacity Binders, 800 sheets","Material de oficina","Carpetas"
"OFF-BI-10002160-1","Acco Hanging Data Binders","Material de oficina","Carpetas"
"OFF-BI-10002194-1","Cardinal Hold-It CD Pocket","Material de oficina","Carpetas"
"OFF-BI-10002215-1","Wilson Jones Hanging View Binder, White, 1""","Material de oficina","Carpetas"
"OFF-BI-10002225-1","Square Ring Data Binders, Rigid 75 Pt. Covers, 11"" x 14-7/8""","Material de oficina","Carpetas"
"OFF-BI-10002309-1","Avery Heavy-Duty EZD  Binder With Locking Rings","Material de oficina","Carpetas"
"OFF-BI-10002353-1","GBC VeloBind Cover Sets","Material de oficina","Carpetas"
"OFF-BI-10002393-1","Binder Posts","Material de oficina","Carpetas"
"OFF-BI-10002412-1","Wilson Jones “Snap” Scratch Pad Binder Tool for Ring Binders","Material de oficina","Carpetas"
"OFF-BI-10002414-1","GBC ProClick Spines for 32-Hole Punch","Material de oficina","Carpetas"
"OFF-BI-10002429-1","Premier Elliptical Ring Binder, Black","Material de oficina","Carpetas"
"OFF-BI-10002432-1","Wilson Jones Standard D-Ring Binders","Material de oficina","Carpetas"
"OFF-BI-10002437-1","Recycled Premium Regency Composition Covers","Material de oficina","Carpetas"
"OFF-BI-10002498-1","Clear Mylar Reinforcing Strips","Material de oficina","Carpetas"
"OFF-BI-10002557-1","Presstex Flexible Ring Binders","Material de oficina","Carpetas"
"OFF-BI-10002571-1","Avery Framed View Binder, EZD Ring (Locking), Navy, 1 1/2""","Material de oficina","Carpetas"
"OFF-BI-10002609-1","Avery Hidden Tab Dividers for Binding Systems","Material de oficina","Carpetas"
"OFF-BI-10002706-1","Avery Premier Heavy-Duty Binder with Round Locking Rings","Material de oficina","Carpetas"
"OFF-BI-10002735-1","GBC Prestige Therm-A-Bind Covers","Material de oficina","Carpetas"
"OFF-BI-10002764-1","Recycled Pressboard Report Cover with Reinforced Top Hinge","Material de oficina","Carpetas"
"OFF-BI-10002794-1","Avery Trapezoid Ring Binder, 3"" Capacity, Black, 1040 sheets","Material de oficina","Carpetas"
"OFF-BI-10002799-1","SlimView Poly Binder, 3/8""","Material de oficina","Carpetas"
"OFF-BI-10002813-1","Avery Reinforcements for Hole-Punch Pages","Material de oficina","Carpetas"
"OFF-BI-10002824-1","Recycled Easel Ring Binders","Material de oficina","Carpetas"
"OFF-BI-10002827-1","Avery Durable Poly Binders","Material de oficina","Carpetas"
"OFF-BI-10002852-1","Ibico Standard Transparent Covers","Material de oficina","Carpetas"
"OFF-BI-10002854-1","Performers Binder/Pad Holder, Black","Material de oficina","Carpetas"
"OFF-BI-10002867-1","GBC Recycled Regency Composition Covers","Material de oficina","Carpetas"
"OFF-BI-10002897-1","Black Avery Memo-Size 3-Ring Binder, 5 1/2"" x 8 1/2""","Material de oficina","Carpetas"
"OFF-BI-10002931-1","Avery Trapezoid Extra Heavy Duty 4"" Binders","Material de oficina","Carpetas"
"OFF-BI-10002949-1","Prestige Round Ring Binders","Material de oficina","Carpetas"
"OFF-BI-10002954-1","Newell 3-Hole Punched Plastic Slotted Magazine Holders for Binders","Material de oficina","Carpetas"
"OFF-BI-10002976-1","ACCOHIDE Binder by Acco","Material de oficina","Carpetas"
"OFF-BI-10002982-1","Avery Self-Adhesive Photo Pockets for Polaroid Photos","Material de oficina","Carpetas"
"OFF-BI-10003007-1","Premium Transparent Presentation Covers, No Pattern/Clear, 8 1/2"" x 11""","Material de oficina","Carpetas"
"OFF-BI-10003091-1","GBC DocuBind TL200 Manual Binding Machine","Material de oficina","Carpetas"
"OFF-BI-10003094-1","Self-Adhesive Ring Binder Labels","Material de oficina","Carpetas"
"OFF-BI-10003166-1","GBC Plasticlear Binding Covers","Material de oficina","Carpetas"
"OFF-BI-10003196-1","Accohide Poly Flexible Ring Binders","Material de oficina","Carpetas"
"OFF-BI-10003274-1","Avery Durable Slant Ring Binders, No Labels","Material de oficina","Carpetas"
"OFF-BI-10003291-1","Wilson Jones Leather-Like Binders with DublLock Round Rings","Material de oficina","Carpetas"
"OFF-BI-10003305-1","Avery Hanging File Binders","Material de oficina","Carpetas"
"OFF-BI-10003314-1","Tuff Stuff Recycled Round Ring Binders","Material de oficina","Carpetas"
"OFF-BI-10003350-1","Acco Expandable Hanging Binders","Material de oficina","Carpetas"
"OFF-BI-10003355-1","Cardinal Holdit Business Card Pockets","Material de oficina","Carpetas"
"OFF-BI-10003364-1","Binding Machine Supplies","Material de oficina","Carpetas"
"OFF-BI-10003429-1","Cardinal HOLDit! Binder Insert Strips,Extra Strips","Material de oficina","Carpetas"
"OFF-BI-10003460-1","Acco 3-Hole Punch","Material de oficina","Carpetas"
"OFF-BI-10003476-1","Avery Metallic Poly Binders","Material de oficina","Carpetas"
"OFF-BI-10003527-1","Fellowes PB500 Electric Punch Plastic Comb Binding Machine with Manual Bind","Material de oficina","Carpetas"
"OFF-BI-10003529-1","Avery Round Ring Poly Binders","Material de oficina","Carpetas"
"OFF-BI-10003638-1","GBC Durable Plastic Covers","Material de oficina","Carpetas"
"OFF-BI-10003650-1","GBC DocuBind 300 Electric Binding Machine","Material de oficina","Carpetas"
"OFF-BI-10003655-1","Durable Pressboard Binders","Material de oficina","Carpetas"
"OFF-BI-10003656-1","Fellowes PB200 Plastic Comb Binding Machine","Material de oficina","Carpetas"
"OFF-BI-10003669-1","3M Organizer Strips","Material de oficina","Carpetas"
"OFF-BI-10003676-1","GBC Standard Recycled Report Covers, Clear Plastic Sheets","Material de oficina","Carpetas"
"OFF-BI-10003684-1","Wilson Jones Legal Size Ring Binders","Material de oficina","Carpetas"
"OFF-BI-10003694-1","Avery 3 1/2"" Diskette Storage Pages, 10/Pack","Material de oficina","Carpetas"
"OFF-BI-10003707-1","Aluminum Screw Posts","Material de oficina","Carpetas"
"OFF-BI-10003708-1","Acco Four Pocket Poly Ring Binder with Label Holder, Smoke, 1""","Material de oficina","Carpetas"
"OFF-BI-10003712-1","Acco Pressboard Covers with Storage Hooks, 14 7/8"" x 11"", Light Blue","Material de oficina","Carpetas"
"OFF-BI-10003718-1","GBC Therma-A-Bind 250T Electric Binding System","Material de oficina","Carpetas"
"OFF-BI-10003719-1","Large Capacity Hanging Post Binders","Material de oficina","Carpetas"
"OFF-BI-10003727-1","Avery Durable Slant Ring Binders With Label Holder","Material de oficina","Carpetas"
"OFF-BI-10003784-1","Computer Printout Index Tabs","Material de oficina","Carpetas"
"OFF-BI-10003876-1","Green Canvas Binder for 8-1/2"" x 14"" Sheets","Material de oficina","Carpetas"
"OFF-BI-10003910-1","DXL Angle-View Binders with Locking Rings by Samsill","Material de oficina","Carpetas"
"OFF-BI-10003925-1","Fellowes PB300 Plastic Comb Binding Machine","Material de oficina","Carpetas"
"OFF-BI-10003963-1","Cardinal Holdit Data Disk Pockets","Material de oficina","Carpetas"
"OFF-BI-10003981-1","Avery Durable Plastic 1"" Binders","Material de oficina","Carpetas"
"OFF-BI-10003982-1","Wilson Jones Century Plastic Molded Ring Binders","Material de oficina","Carpetas"
"OFF-BI-10003984-1","Lock-Up Easel 'Spel-Binder'","Material de oficina","Carpetas"
"OFF-BI-10004001-1","GBC Recycled VeloBinder Covers","Material de oficina","Carpetas"
"OFF-BI-10004002-1","Wilson Jones International Size A4 Ring Binders","Material de oficina","Carpetas"
"OFF-BI-10004022-1","Acco Suede Grain Vinyl Round Ring Binder","Material de oficina","Carpetas"
"OFF-BI-10004040-1","Wilson Jones Impact Binders","Material de oficina","Carpetas"
"OFF-BI-10004094-1","GBC Standard Plastic Binding Systems Combs","Material de oficina","Carpetas"
"OFF-BI-10004099-1","GBC VeloBinder Strips","Material de oficina","Carpetas"
"OFF-BI-10004139-1","Fellowes Presentation Covers for Comb Binding Machines","Material de oficina","Carpetas"
