"id_del_producto","nombre_del_producto","categoria","subcategoria"
"FUR-BO-10000112-1","Bush Birmingham Collection Bookcase, Dark Cherry","Mobiliario","Librerías"
"FUR-BO-10000330-1","Sauder Camden County Barrister Bookcase, Planked Cherry Finish","Mobiliario","Librerías"
"FUR-BO-10000362-1","Sauder Inglewood Library Bookcases","Mobiliario","Librerías"
"FUR-BO-10000468-1","O'Sullivan 2-Shelf Heavy-Duty Bookcases","Mobiliario","Librerías"
"FUR-BO-10000711-1","Hon Metal Bookcases, Gray","Mobiliario","Librerías"
"FUR-BO-10000780-1","O'Sullivan Plantations 2-Door Library in Landvery Oak","Mobiliario","Librerías"
"FUR-BO-10001337-1","O'Sullivan Living Dimensions 2-Shelf Bookcases","Mobiliario","Librerías"
"FUR-BO-10001519-1","O'Sullivan 3-Shelf Heavy-Duty Bookcases","Mobiliario","Librerías"
"FUR-BO-10001567-1","Bush Westfield Collection Bookcases, Dark Cherry Finish, Fully Assembled","Mobiliario","Librerías"
"FUR-BO-10001601-1","Sauder Mission Library with Doors, Fruitwood Finish","Mobiliario","Librerías"
"FUR-BO-10001608-1","Hon Metal Bookcases, Black","Mobiliario","Librerías"
"FUR-BO-10001619-1","O'Sullivan Cherrywood Estates Traditional Bookcase","Mobiliario","Librerías"
"FUR-BO-10001798-1","Bush Somerset Collection Bookcase","Mobiliario","Librerías"
"FUR-BO-10001811-1","Atlantic Metals Mobile 5-Shelf Bookcases, Custom Colors","Mobiliario","Librerías"
"FUR-BO-10001918-1","Sauder Forest Hills Library with Doors, Woodland Oak Finish","Mobiliario","Librerías"
"FUR-BO-10001972-1","O'Sullivan 4-Shelf Bookcase in Odessa Pine","Mobiliario","Librerías"
"FUR-BO-10002202-1","Atlantic Metals Mobile 2-Shelf Bookcases, Custom Colors","Mobiliario","Librerías"
"FUR-BO-10002206-1","Bush Saratoga Collection 5-Shelf Bookcase, Hanover Cherry, *Special Order","Mobiliario","Librerías"
"FUR-BO-10002213-1","DMI Eclipse Executive Suite Bookcases","Mobiliario","Librerías"
"FUR-BO-10002213-2","Sauder Forest Hills Library, Woodland Oak Finish","Mobiliario","Librerías"
"FUR-BO-10002268-1","Sauder Barrister Bookcases","Mobiliario","Librerías"
"FUR-BO-10002545-1","Atlantic Metals Mobile 3-Shelf Bookcases, Custom Colors","Mobiliario","Librerías"
"FUR-BO-10002598-1","Hon Metal Bookcases, Putty","Mobiliario","Librerías"
"FUR-BO-10002613-1","Atlantic Metals Mobile 4-Shelf Bookcases, Custom Colors","Mobiliario","Librerías"
"FUR-BO-10002824-1","Bush Mission Pointe Library","Mobiliario","Librerías"
"FUR-BO-10002853-1","O'Sullivan 5-Shelf Heavy-Duty Bookcases","Mobiliario","Librerías"
"FUR-BO-10002916-1","Rush Hierlooms Collection 1"" Thick Stackable Bookcases","Mobiliario","Librerías"
"FUR-BO-10003034-1","O'Sullivan Elevations Bookcase, Cherry Finish","Mobiliario","Librerías"
"FUR-BO-10003159-1","Sauder Camden County Collection Libraries, Planked Cherry Finish","Mobiliario","Librerías"
"FUR-BO-10003272-1","O'Sullivan Living Dimensions 5-Shelf Bookcases","Mobiliario","Librerías"
"FUR-BO-10003404-1","Global Adaptabilites Bookcase, Cherry/Storm Gray Finish","Mobiliario","Librerías"
"FUR-BO-10003433-1","Sauder Cornerstone Collection Library","Mobiliario","Librerías"
"FUR-BO-10003441-1","Bush Westfield Collection Bookcases, Fully Assembled","Mobiliario","Librerías"
"FUR-BO-10003450-1","Bush Westfield Collection Bookcases, Dark Cherry Finish","Mobiliario","Librerías"
"FUR-BO-10003546-1","Hon 4-Shelf Metal Bookcases","Mobiliario","Librerías"
"FUR-BO-10003660-1","Bush Cubix Collection Bookcases, Fully Assembled","Mobiliario","Librerías"
"FUR-BO-10003893-1","Sauder Camden County Collection Library","Mobiliario","Librerías"
"FUR-BO-10003894-1","Safco Value Mate Steel Bookcase, Baked Enamel Finish on Steel, Black","Mobiliario","Librerías"
"FUR-BO-10003965-1","O'Sullivan Manor Hill 2-Door Library in Brianna Oak","Mobiliario","Librerías"
"FUR-BO-10003966-1","Sauder Facets Collection Library, Sky Alder Finish","Mobiliario","Librerías"
"FUR-BO-10004015-1","Bush Andora Bookcase, Maple/Graphite Gray Finish","Mobiliario","Librerías"
"FUR-BO-10004218-1","Bush Heritage Pine Collection 5-Shelf Bookcase, Albany Pine Finish, *Special Order","Mobiliario","Librerías"
"FUR-BO-10004357-1","O'Sullivan Living Dimensions 3-Shelf Bookcases","Mobiliario","Librerías"
"FUR-BO-10004360-1","Rush Hierlooms Collection Rich Wood Bookcases","Mobiliario","Librerías"
"FUR-BO-10004409-1","Safco Value Mate Series Steel Bookcases, Baked Enamel Finish on Steel, Gray","Mobiliario","Librerías"
"FUR-BO-10004467-1","Bestar Classic Bookcase","Mobiliario","Librerías"
"FUR-BO-10004690-1","O'Sullivan Cherrywood Estates Traditional Barrister Bookcase","Mobiliario","Librerías"
"FUR-BO-10004695-1","O'Sullivan 2-Door Barrister Bookcase in Odessa Pine","Mobiliario","Librerías"
"FUR-BO-10004709-1","Bush Westfield Collection Bookcases, Medium Cherry Finish","Mobiliario","Librerías"
"FUR-BO-10004834-1","Riverside Palais Royal Lawyers Bookcase, Royale Cherry Finish","Mobiliario","Librerías"
"FUR-CH-10000015-1","Hon Multipurpose Stacking Arm Chairs","Mobiliario","Sillas"
"FUR-CH-10000155-1","Global Comet Stacking Armless Chair","Mobiliario","Sillas"
"FUR-CH-10000225-1","Global Geo Office Task Chair, Gray","Mobiliario","Sillas"
"FUR-CH-10000229-1","Global Enterprise Series Seating High-Back Swivel/Tilt Chairs","Mobiliario","Sillas"
"FUR-CH-10000309-1","Global Comet Stacking Arm Chair","Mobiliario","Sillas"
"FUR-CH-10000422-1","Global Highback Leather Tilter in Burgundy","Mobiliario","Sillas"
"FUR-CH-10000454-1","Hon Deluxe Fabric Upholstered Stacking Chairs, Rounded Back","Mobiliario","Sillas"
"FUR-CH-10000513-1","High-Back Leather Manager's Chair","Mobiliario","Sillas"
"FUR-CH-10000553-1","Metal Folding Chairs, Beige, 4/Carton","Mobiliario","Sillas"
"FUR-CH-10000595-1","Safco Contoured Stacking Chairs","Mobiliario","Sillas"
"FUR-CH-10000665-1","Global Airflow Leather Mesh Back Chair, Black","Mobiliario","Sillas"
"FUR-CH-10000749-1","Office Star - Ergonomic Mid Back Chair with 2-Way Adjustable Arms","Mobiliario","Sillas"
"FUR-CH-10000785-1","Global Ergonomic Managers Chair","Mobiliario","Sillas"
"FUR-CH-10000847-1","Global Executive Mid-Back Manager's Chair","Mobiliario","Sillas"
"FUR-CH-10000863-1","Novimex Swivel Fabric Task Chair","Mobiliario","Sillas"
"FUR-CH-10000988-1","Hon Olson Stacker Stools","Mobiliario","Sillas"
"FUR-CH-10001146-1","Global Task Chair, Black","Mobiliario","Sillas"
"FUR-CH-10001146-2","Global Value Mid-Back Manager's Chair, Gray","Mobiliario","Sillas"
"FUR-CH-10001190-1","Global Deluxe High-Back Office Chair in Storm","Mobiliario","Sillas"
"FUR-CH-10001215-1","Global Troy Executive Leather Low-Back Tilter","Mobiliario","Sillas"
"FUR-CH-10001270-1","Harbour Creations Steel Folding Chair","Mobiliario","Sillas"
"FUR-CH-10001394-1","Global Leather Executive Chair","Mobiliario","Sillas"
"FUR-CH-10001482-1","Office Star - Mesh Screen back chair with Vinyl seat","Mobiliario","Sillas"
"FUR-CH-10001545-1","Hon Comfortask Task/Swivel Chairs","Mobiliario","Sillas"
"FUR-CH-10001708-1","Office Star - Contemporary Swivel Chair with Padded Adjustable Arms and Flex Back","Mobiliario","Sillas"
"FUR-CH-10001714-1","Global Leather & Oak Executive Chair, Burgundy","Mobiliario","Sillas"
"FUR-CH-10001797-1","Safco Chair Connectors, 6/Carton","Mobiliario","Sillas"
"FUR-CH-10001802-1","Hon Every-Day Chair Series Swivel Task Chairs","Mobiliario","Sillas"
"FUR-CH-10001854-1","Office Star - Professional Matrix Back Chair with 2-to-1 Synchro Tilt and Mesh Fabric Seat","Mobiliario","Sillas"
"FUR-CH-10001891-1","Global Deluxe Office Fabric Chairs","Mobiliario","Sillas"
"FUR-CH-10001973-1","Office Star Flex Back Scooter Chair with White Frame","Mobiliario","Sillas"
"FUR-CH-10002017-1","SAFCO Optional Arm Kit for Workspace Cribbage Stacking Chair","Mobiliario","Sillas"
"FUR-CH-10002024-1","HON 5400 Series Task Chairs for Big and Tall","Mobiliario","Sillas"
"FUR-CH-10002044-1","Office Star - Contemporary Task Swivel chair with 2-way adjustable arms, Plum","Mobiliario","Sillas"
"FUR-CH-10002073-1","Hon Olson Stacker Chairs","Mobiliario","Sillas"
"FUR-CH-10002084-1","Hon Mobius Operator's Chair","Mobiliario","Sillas"
"FUR-CH-10002126-1","Hon Deluxe Fabric Upholstered Stacking Chairs","Mobiliario","Sillas"
"FUR-CH-10002304-1","Global Stack Chair without Arms, Black","Mobiliario","Sillas"
"FUR-CH-10002317-1","Global Enterprise Series Seating Low-Back Swivel/Tilt Chairs","Mobiliario","Sillas"
"FUR-CH-10002320-1","Hon Pagoda Stacking Chairs","Mobiliario","Sillas"
"FUR-CH-10002331-1","Hon 4700 Series Mobuis Mid-Back Task Chairs with Adjustable Arms","Mobiliario","Sillas"
"FUR-CH-10002335-1","Hon GuestStacker Chair","Mobiliario","Sillas"
"FUR-CH-10002372-1","Office Star - Ergonomically Designed Knee Chair","Mobiliario","Sillas"
"FUR-CH-10002439-1","Iceberg Nesting Folding Chair, 19w x 6d x 43h","Mobiliario","Sillas"
"FUR-CH-10002602-1","DMI Arturo Collection Mission-style Design Wood Chair","Mobiliario","Sillas"
"FUR-CH-10002647-1","Situations Contoured Folding Chairs, 4/Set","Mobiliario","Sillas"
"FUR-CH-10002758-1","Hon Deluxe Fabric Upholstered Stacking Chairs, Squared Back","Mobiliario","Sillas"
"FUR-CH-10002774-1","Global Deluxe Stacking Chair, Gray","Mobiliario","Sillas"
"FUR-CH-10002780-1","Office Star - Task Chair with Contemporary Loop Arms","Mobiliario","Sillas"
"FUR-CH-10002880-1","Global High-Back Leather Tilter, Burgundy","Mobiliario","Sillas"
"FUR-CH-10002961-1","Leather Task Chair, Black","Mobiliario","Sillas"
"FUR-CH-10002965-1","Global Leather Highback Executive Chair with Pneumatic Height Adjustment, Black","Mobiliario","Sillas"
"FUR-CH-10003061-1","Global Leather Task Chair, Black","Mobiliario","Sillas"
"FUR-CH-10003199-1","Office Star - Contemporary Task Swivel Chair","Mobiliario","Sillas"
"FUR-CH-10003298-1","Office Star - Contemporary Task Swivel chair with Loop Arms, Charcoal","Mobiliario","Sillas"
"FUR-CH-10003312-1","Hon 2090 “Pillow Soft” Series Mid Back Swivel/Tilt Chairs","Mobiliario","Sillas"
"FUR-CH-10003379-1","Global Commerce Series High-Back Swivel/Tilt Chairs","Mobiliario","Sillas"
"FUR-CH-10003396-1","Global Deluxe Steno Chair","Mobiliario","Sillas"
"FUR-CH-10003535-1","Global Armless Task Chair, Royal Blue","Mobiliario","Sillas"
"FUR-CH-10003606-1","SAFCO Folding Chair Trolley","Mobiliario","Sillas"
"FUR-CH-10003746-1","Hon 4070 Series Pagoda Round Back Stacking Chairs","Mobiliario","Sillas"
"FUR-CH-10003761-1","Global Italian Leather Office Chair","Mobiliario","Sillas"
"FUR-CH-10003774-1","Global Wood Trimmed Manager's Task Chair, Khaki","Mobiliario","Sillas"
"FUR-CH-10003817-1","Global Value Steno Chair, Gray","Mobiliario","Sillas"
"FUR-CH-10003833-1","Novimex Fabric Task Chair","Mobiliario","Sillas"
"FUR-CH-10003846-1","Hon Valutask Swivel Chairs","Mobiliario","Sillas"
"FUR-CH-10003956-1","Novimex High-Tech Fabric Mesh Task Chair","Mobiliario","Sillas"
"FUR-CH-10003968-1","Novimex Turbo Task Chair","Mobiliario","Sillas"
"FUR-CH-10003973-1","GuestStacker Chair with Chrome Finish Legs","Mobiliario","Sillas"
"FUR-CH-10003981-1","Global Commerce Series Low-Back Swivel/Tilt Chairs","Mobiliario","Sillas"
"FUR-CH-10004063-1","Global Deluxe High-Back Manager's Chair","Mobiliario","Sillas"
"FUR-CH-10004086-1","Hon 4070 Series Pagoda Armless Upholstered Stacking Chairs","Mobiliario","Sillas"
"FUR-CH-10004218-1","Global Fabric Manager's Chair, Dark Gray","Mobiliario","Sillas"
"FUR-CH-10004287-1","SAFCO Arco Folding Chair","Mobiliario","Sillas"
"FUR-CH-10004289-1","Global Super Steno Chair","Mobiliario","Sillas"
"FUR-CH-10004477-1","Global Push Button Manager's Chair, Indigo","Mobiliario","Sillas"
"FUR-CH-10004495-1","Global Leather and Oak Executive Chair, Black","Mobiliario","Sillas"
"FUR-CH-10004540-1","Global Chrome Stack Chair","Mobiliario","Sillas"
"FUR-CH-10004626-1","Office Star Flex Back Scooter Chair with Aluminum Finish Frame","Mobiliario","Sillas"
"FUR-CH-10004675-1","Lifetime Advantage Folding Chairs, 4/Carton","Mobiliario","Sillas"
"FUR-CH-10004698-1","Padded Folding Chairs, Black, 4/Carton","Mobiliario","Sillas"
"FUR-CH-10004754-1","Global Stack Chair with Arms, Black","Mobiliario","Sillas"
"FUR-CH-10004853-1","Global Manager's Adjustable Task Chair, Storm","Mobiliario","Sillas"
"FUR-CH-10004860-1","Global Low Back Tilter Chair","Mobiliario","Sillas"
"FUR-CH-10004875-1","Harbour Creations 67200 Series Stacking Chairs","Mobiliario","Sillas"
"FUR-CH-10004886-1","Bevis Steel Folding Chairs","Mobiliario","Sillas"
"FUR-CH-10004983-1","Office Star - Mid Back Dual function Ergonomic High Back Chair with 2-Way Adjustable Arms","Mobiliario","Sillas"
"FUR-CH-10004997-1","Hon Every-Day Series Multi-Task Chairs","Mobiliario","Sillas"
"FUR-FU-10000010-1","DAX Value U-Channel Document Frames, Easel Back","Mobiliario","Mobiliario"
"FUR-FU-10000023-1","Eldon Wave Desk Accessories","Mobiliario","Mobiliario"
"FUR-FU-10000073-1","Deflect-O Glasstique Clear Desk Accessories","Mobiliario","Mobiliario"
"FUR-FU-10000076-1","24-Hour Round Wall Clock","Mobiliario","Mobiliario"
"FUR-FU-10000087-1","Executive Impressions 14"" Two-Color Numerals Wall Clock","Mobiliario","Mobiliario"
"FUR-FU-10000175-1","DAX Wood Document Frame","Mobiliario","Mobiliario"
"FUR-FU-10000193-1","Tenex Chairmats For Use with Hard Floors","Mobiliario","Mobiliario"
"FUR-FU-10000206-1","GE General Purpose, Extra Long Life, Showcase & Floodlight Incandescent Bulbs","Mobiliario","Mobiliario"
"FUR-FU-10000221-1","Master Caster Door Stop, Brown","Mobiliario","Mobiliario"
"FUR-FU-10000222-1","Seth Thomas 16"" Steel Case Clock","Mobiliario","Mobiliario"
"FUR-FU-10000246-1","Aluminum Document Frame","Mobiliario","Mobiliario"
"FUR-FU-10000260-1","6"" Cubicle Wall Clock, Black","Mobiliario","Mobiliario"
"FUR-FU-10000277-1","Deflect-o DuraMat Antistatic Studded Beveled Mat for Medium Pile Carpeting","Mobiliario","Mobiliario"
"FUR-FU-10000293-1","Eldon Antistatic Chair Mats for Low to Medium Pile Carpets","Mobiliario","Mobiliario"
"FUR-FU-10000305-1","Tenex V2T-RE Standard Weight Series Chair Mat, 45"" x 53"", Lip 25"" x 12""","Mobiliario","Mobiliario"
"FUR-FU-10000308-1","Deflect-o Glass Clear Studded Chair Mats","Mobiliario","Mobiliario"
"FUR-FU-10000320-1","OIC Stacking Trays","Mobiliario","Mobiliario"
"FUR-FU-10000397-1","Luxo Economy Swing Arm Lamp","Mobiliario","Mobiliario"
"FUR-FU-10000409-1","GE 4 Foot Flourescent Tube, 40 Watt","Mobiliario","Mobiliario"
"FUR-FU-10000448-1","Tenex Chairmats For Use With Carpeted Floors","Mobiliario","Mobiliario"
"FUR-FU-10000521-1","Seth Thomas 14"" Putty-Colored Wall Clock","Mobiliario","Mobiliario"
"FUR-FU-10000550-1","Stacking Trays by OIC","Mobiliario","Mobiliario"
"FUR-FU-10000576-1","Luxo Professional Fluorescent Magnifier Lamp with Clamp-Mount Base","Mobiliario","Mobiliario"
"FUR-FU-10000629-1","9-3/4 Diameter Round Wall Clock","Mobiliario","Mobiliario"
"FUR-FU-10000672-1","Executive Impressions 10"" Spectator Wall Clock","Mobiliario","Mobiliario"
"FUR-FU-10000719-1","DAX Cubicle Frames, 8-1/2 x 11","Mobiliario","Mobiliario"
"FUR-FU-10000723-1","Deflect-o EconoMat Studded, No Bevel Mat for Low Pile Carpeting","Mobiliario","Mobiliario"
"FUR-FU-10000732-1","Eldon 200 Class Desk Accessories","Mobiliario","Mobiliario"
"FUR-FU-10000747-1","Tenex B1-RE Series Chair Mats for Low Pile Carpets","Mobiliario","Mobiliario"
"FUR-FU-10000755-1","Eldon Expressions Mahogany Wood Desk Collection","Mobiliario","Mobiliario"
"FUR-FU-10000758-1","DAX Natural Wood-Tone Poster Frame","Mobiliario","Mobiliario"
"FUR-FU-10000771-1","Eldon 200 Class Desk Accessories, Smoke","Mobiliario","Mobiliario"
"FUR-FU-10000794-1","Eldon Stackable Tray, Side-Load, Legal, Smoke","Mobiliario","Mobiliario"
"FUR-FU-10000820-1","Tensor Brushed Steel Torchiere Floor Lamp","Mobiliario","Mobiliario"
"FUR-FU-10000965-1","Howard Miller 11-1/2"" Diameter Ridgewood Wall Clock","Mobiliario","Mobiliario"
"FUR-FU-10001025-1","Eldon Imàge Series Desk Accessories, Clear","Mobiliario","Mobiliario"
"FUR-FU-10001037-1","DAX Charcoal/Nickel-Tone Document Frame, 5 x 7","Mobiliario","Mobiliario"
"FUR-FU-10001057-1","Tensor Track Tree Floor Lamp","Mobiliario","Mobiliario"
"FUR-FU-10001085-1","3M Polarizing Light Filter Sleeves","Mobiliario","Mobiliario"
"FUR-FU-10001095-1","DAX Black Cherry Wood-Tone Poster Frame","Mobiliario","Mobiliario"
"FUR-FU-10001185-1","Advantus Employee of the Month Certificate Frame, 11 x 13-1/2","Mobiliario","Mobiliario"
"FUR-FU-10001196-1","DAX Cubicle Frames - 8x10","Mobiliario","Mobiliario"
"FUR-FU-10001215-1","Howard Miller 11-1/2"" Diameter Brentwood Wall Clock","Mobiliario","Mobiliario"
"FUR-FU-10001290-1","Executive Impressions Supervisor Wall Clock","Mobiliario","Mobiliario"
"FUR-FU-10001379-1","Executive Impressions 16-1/2"" Circular Wall Clock","Mobiliario","Mobiliario"
"FUR-FU-10001424-1","Dax Clear Box Frame","Mobiliario","Mobiliario"
"FUR-FU-10001468-1","Tenex Antistatic Computer Chair Mats","Mobiliario","Mobiliario"
"FUR-FU-10001473-1","DAX Wood Document Frame","Mobiliario","Mobiliario"
"FUR-FU-10001473-2","Eldon Executive Woodline II Desk Accessories, Mahogany","Mobiliario","Mobiliario"
"FUR-FU-10001475-1","Contract Clock, 14"", Brown","Mobiliario","Mobiliario"
"FUR-FU-10001487-1","Eldon Expressions Wood and Plastic Desk Accessories, Cherry Wood","Mobiliario","Mobiliario"
"FUR-FU-10001488-1","Tenex 46"" x 60"" Computer Anti-Static Chairmat, Rectangular Shaped","Mobiliario","Mobiliario"
"FUR-FU-10001546-1","Dana Swing-Arm Lamps","Mobiliario","Mobiliario"
"FUR-FU-10001588-1","Deflect-o SuperTray Unbreakable Stackable Tray, Letter, Black","Mobiliario","Mobiliario"
"FUR-FU-10001591-1","Advantus Panel Wall Certificate Holder - 8.5x11","Mobiliario","Mobiliario"
"FUR-FU-10001602-1","Eldon Delta Triangular Chair Mat, 52"" x 58"", Clear","Mobiliario","Mobiliario"
"FUR-FU-10001617-1","Executive Impressions 8-1/2"" Career Panel/Partition Cubicle Clock","Mobiliario","Mobiliario"
"FUR-FU-10001706-1","Longer-Life Soft White Bulbs","Mobiliario","Mobiliario"
"FUR-FU-10001731-1","Acrylic Self-Standing Desk Frames","Mobiliario","Mobiliario"
"FUR-FU-10001756-1","Eldon Expressions Desk Accessory, Wood Photo Frame, Mahogany","Mobiliario","Mobiliario"
"FUR-FU-10001847-1","Eldon Image Series Black Desk Accessories","Mobiliario","Mobiliario"
"FUR-FU-10001852-1","Eldon Regeneration Recycled Desk Accessories, Smoke","Mobiliario","Mobiliario"
"FUR-FU-10001861-1","Floodlight Indoor Halogen Bulbs, 1 Bulb per Pack, 60 Watts","Mobiliario","Mobiliario"
"FUR-FU-10001867-1","Eldon Expressions Punched Metal & Wood Desk Accessories, Pewter & Cherry","Mobiliario","Mobiliario"
"FUR-FU-10001876-1","Computer Room Manger, 14""","Mobiliario","Mobiliario"
"FUR-FU-10001889-1","Ultra Door Pull Handle","Mobiliario","Mobiliario"
"FUR-FU-10001918-1","C-Line Cubicle Keepers Polyproplyene Holder With Velcro Backings","Mobiliario","Mobiliario"
"FUR-FU-10001934-1","Magnifier Swing Arm Lamp","Mobiliario","Mobiliario"
"FUR-FU-10001935-1","3M Hangers With Command Adhesive","Mobiliario","Mobiliario"
"FUR-FU-10001940-1","Staple-based wall hangings","Mobiliario","Mobiliario"
"FUR-FU-10001967-1","Telescoping Adjustable Floor Lamp","Mobiliario","Mobiliario"
"FUR-FU-10001979-1","Dana Halogen Swing-Arm Architect Lamp","Mobiliario","Mobiliario"
"FUR-FU-10001986-1","Dana Fluorescent Magnifying Lamp, White, 36""","Mobiliario","Mobiliario"
"FUR-FU-10002030-1","Executive Impressions 14"" Contract Wall Clock with Quartz Movement","Mobiliario","Mobiliario"
"FUR-FU-10002045-1","Executive Impressions 14""","Mobiliario","Mobiliario"
"FUR-FU-10002088-1","Nu-Dell Float Frame 11 x 14 1/2","Mobiliario","Mobiliario"
"FUR-FU-10002107-1","Eldon Pizzaz Desk Accessories","Mobiliario","Mobiliario"
"FUR-FU-10002111-1","Master Caster Door Stop, Large Brown","Mobiliario","Mobiliario"
"FUR-FU-10002116-1","Tenex Carpeted, Granite-Look or Clear Contemporary Contour Shape Chair Mats","Mobiliario","Mobiliario"
"FUR-FU-10002157-1","Artistic Insta-Plaque","Mobiliario","Mobiliario"
"FUR-FU-10002191-1","G.E. Halogen Desk Lamp Bulbs","Mobiliario","Mobiliario"
"FUR-FU-10002240-1","Nu-Dell EZ-Mount Plastic Wall Frames","Mobiliario","Mobiliario"
"FUR-FU-10002253-1","Howard Miller 13"" Diameter Pewter Finish Round Wall Clock","Mobiliario","Mobiliario"
"FUR-FU-10002268-1","Ultra Door Push Plate","Mobiliario","Mobiliario"
"FUR-FU-10002298-1","Rubbermaid ClusterMat Chairmats, Mat Size- 66"" x 60"", Lip 20"" x 11"" -90 Degree Angle","Mobiliario","Mobiliario"
"FUR-FU-10002364-1","Eldon Expressions Wood Desk Accessories, Oak","Mobiliario","Mobiliario"
"FUR-FU-10002379-1","Eldon Econocleat Chair Mats for Low Pile Carpets","Mobiliario","Mobiliario"
"FUR-FU-10002396-1","DAX Copper Panel Document Frame, 5 x 7 Size","Mobiliario","Mobiliario"
"FUR-FU-10002445-1","DAX Two-Tone Rosewood/Black Document Frame, Desktop, 5 x 7","Mobiliario","Mobiliario"
"FUR-FU-10002456-1","Master Caster Door Stop, Large Neon Orange","Mobiliario","Mobiliario"
"FUR-FU-10002501-1","Nu-Dell Executive Frame","Mobiliario","Mobiliario"
"FUR-FU-10002505-1","Eldon 100 Class Desk Accessories","Mobiliario","Mobiliario"
"FUR-FU-10002506-1","Tensor ""Hersey Kiss"" Styled Floor Lamp","Mobiliario","Mobiliario"
"FUR-FU-10002508-1","Document Clip Frames","Mobiliario","Mobiliario"
"FUR-FU-10002553-1","Electrix Incandescent Magnifying Lamp, Black","Mobiliario","Mobiliario"
"FUR-FU-10002554-1","Westinghouse Floor Lamp with Metal Mesh Shade, Black","Mobiliario","Mobiliario"
"FUR-FU-10002597-1","C-Line Magnetic Cubicle Keepers, Clear Polypropylene","Mobiliario","Mobiliario"
"FUR-FU-10002671-1","Electrix 20W Halogen Replacement Bulb for Zoom-In Desk Lamp","Mobiliario","Mobiliario"
"FUR-FU-10002685-1","Executive Impressions 13-1/2"" Indoor/Outdoor Wall Clock","Mobiliario","Mobiliario"
"FUR-FU-10002703-1","Tenex Traditional Chairmats for Hard Floors, Average Lip, 36"" x 48""","Mobiliario","Mobiliario"
"FUR-FU-10002759-1","12-1/2 Diameter Round Wall Clock","Mobiliario","Mobiliario"
"FUR-FU-10002813-1","DAX Contemporary Wood Frame with Silver Metal Mat, Desktop, 11 x 14 Size","Mobiliario","Mobiliario"
"FUR-FU-10002874-1","Ultra Commercial Grade Dual Valve Door Closer","Mobiliario","Mobiliario"
"FUR-FU-10002878-1","Seth Thomas 14"" Day/Date Wall Clock","Mobiliario","Mobiliario"
"FUR-FU-10002885-1","Magna Visual Magnetic Picture Hangers","Mobiliario","Mobiliario"
"FUR-FU-10002918-1","Eldon ClusterMat Chair Mat with Cordless Antistatic Protection","Mobiliario","Mobiliario"
"FUR-FU-10002937-1","GE 48"" Fluorescent Tube, Cool White Energy Saver, 34 Watts, 30/Box","Mobiliario","Mobiliario"
"FUR-FU-10002960-1","Eldon 200 Class Desk Accessories, Burgundy","Mobiliario","Mobiliario"
"FUR-FU-10002963-1","Master Caster Door Stop, Gray","Mobiliario","Mobiliario"
"FUR-FU-10003026-1","Eldon Regeneration Recycled Desk Accessories, Black","Mobiliario","Mobiliario"
"FUR-FU-10003039-1","Howard Miller 11-1/2"" Diameter Grantwood Wall Clock","Mobiliario","Mobiliario"
"FUR-FU-10003095-1","Linden 12"" Wall Clock With Oak Frame","Mobiliario","Mobiliario"
"FUR-FU-10003096-1","Master Giant Foot Doorstop, Safety Yellow","Mobiliario","Mobiliario"
"FUR-FU-10003142-1","Master Big Foot Doorstop, Beige","Mobiliario","Mobiliario"
"FUR-FU-10003192-1","Luxo Adjustable Task Clamp Lamp","Mobiliario","Mobiliario"
"FUR-FU-10003194-1","Eldon Expressions Desk Accessory, Wood Pencil Holder, Oak","Mobiliario","Mobiliario"
"FUR-FU-10003247-1","36X48 HARDFLOOR CHAIRMAT","Mobiliario","Mobiliario"
"FUR-FU-10003268-1","Eldon Radial Chair Mat for Low to Medium Pile Carpets","Mobiliario","Mobiliario"
"FUR-FU-10003274-1","Regeneration Desk Collection","Mobiliario","Mobiliario"
"FUR-FU-10003347-1","Coloredge Poster Frame","Mobiliario","Mobiliario"
"FUR-FU-10003374-1","Electrix Fluorescent Magnifier Lamps & Weighted Base","Mobiliario","Mobiliario"
"FUR-FU-10003394-1","Tenex ""The Solids"" Textured Chair Mats","Mobiliario","Mobiliario"
"FUR-FU-10003424-1","Nu-Dell Oak Frame","Mobiliario","Mobiliario"
"FUR-FU-10003464-1","Seth Thomas 8 1/2"" Cubicle Clock","Mobiliario","Mobiliario"
"FUR-FU-10003489-1","Contemporary Borderless Frame","Mobiliario","Mobiliario"
"FUR-FU-10003535-1","Howard Miller Distant Time Traveler Alarm Clock","Mobiliario","Mobiliario"
"FUR-FU-10003553-1","Howard Miller 13-1/2"" Diameter Rosebrook Wall Clock","Mobiliario","Mobiliario"
"FUR-FU-10003577-1","Nu-Dell Leatherette Frames","Mobiliario","Mobiliario"
"FUR-FU-10003601-1","Deflect-o RollaMat Studded, Beveled Mat for Medium Pile Carpeting","Mobiliario","Mobiliario"
"FUR-FU-10003623-1","DataProducts Ampli Magnifier Task Lamp, Black,","Mobiliario","Mobiliario"
"FUR-FU-10003664-1","Electrix Architect's Clamp-On Swing Arm Lamp, Black","Mobiliario","Mobiliario"
"FUR-FU-10003691-1","Eldon Image Series Desk Accessories, Ebony","Mobiliario","Mobiliario"
"FUR-FU-10003708-1","Tenex Traditional Chairmats for Medium Pile Carpet, Standard Lip, 36"" x 48""","Mobiliario","Mobiliario"
"FUR-FU-10003724-1","Westinghouse Clip-On Gooseneck Lamps","Mobiliario","Mobiliario"
"FUR-FU-10003731-1","Eldon Expressions Wood and Plastic Desk Accessories, Oak","Mobiliario","Mobiliario"
"FUR-FU-10003773-1","Eldon Cleatmat Plus Chair Mats for High Pile Carpets","Mobiliario","Mobiliario"
"FUR-FU-10003798-1","Ultra Door Kickplate, 8""H x 34""W","Mobiliario","Mobiliario"
"FUR-FU-10003799-1","Seth Thomas 13 1/2"" Wall Clock","Mobiliario","Mobiliario"
"FUR-FU-10003806-1","Tenex Chairmat w/ Average Lip, 45"" x 53""","Mobiliario","Mobiliario"
"FUR-FU-10003829-1","Stackable Trays","Mobiliario","Mobiliario"
"FUR-FU-10003832-1","Eldon Expressions Punched Metal & Wood Desk Accessories, Black & Cherry","Mobiliario","Mobiliario"
"FUR-FU-10003849-1","DAX Metal Frame, Desktop, Stepped-Edge","Mobiliario","Mobiliario"
